{
  "id": "jacobs",
  "name": "Jacobs",
  "country": "USA",
  "roles": [
    "epc"
  ],
  "description": "US engineering firm with sulfur-recovery and refinery EPC practice.",
  "technologies": [
    "gas-sulfur-recovery"
  ],
  "url": "https://www.jacobs.com",
  "sources": [
    {
      "url": "https://www.jacobs.com",
      "note": "Vendor site, read 2026-10-28"
    }
  ],
  "last_reviewed": "2026-10-28"
}
